{"$id":"https://paperworks.local/schemas/v6/t1b_selection_policy_v1_schema.json","$schema":"https://json-schema.org/draft/2020-12/schema","additionalProperties":false,"properties":{"all_calls_run_even_after_admissible":{"type":"boolean"},"artifact_hash":{"pattern":"^[a-f0-9]{64}$","type":"string"},"artifact_type":{"const":"t1b_selection_policy_v1","type":"string"},"budget_policy_hash":{"pattern":"^[a-f0-9]{64}$","type":"string"},"calls_are_independent":{"type":"boolean"},"cross_call_memory":{"type":"boolean"},"generation_calls_required":{"type":"integer"},"none_admissible_outcome":{"type":"string"},"policy_id":{"type":"string"},"prior_proposal_visible":{"type":"boolean"},"same_initial_evidence_view":{"type":"boolean"},"same_model_config":{"type":"boolean"},"same_prompt_template":{"type":"boolean"},"schema_version":{"const":"1.0.0","type":"string"},"selection_rule":{"type":"string"},"utility_based_selection":{"type":"boolean"},"verifier_feedback_visible":{"type":"boolean"}},"required":["schema_version","artifact_type","policy_id","budget_policy_hash","generation_calls_required","calls_are_independent","same_initial_evidence_view","same_prompt_template","same_model_config","prior_proposal_visible","verifier_feedback_visible","cross_call_memory","all_calls_run_even_after_admissible","selection_rule","none_admissible_outcome","utility_based_selection","artifact_hash"],"title":"t1b_selection_policy_v1","type":"object"}
