{"all_calls_run_even_after_admissible":true,"artifact_hash":"d059a48d3969c4928fa2e20c288153fba7a51c327728cd400170f91fc00da079","artifact_type":"t1b_selection_policy_v1","budget_policy_hash":"d36e297cb1de71d4a04f4ad99a31d7c75c076d1b2d6b2ccb74905bdcf4cc1c64","calls_are_independent":true,"cross_call_memory":false,"generation_calls_required":3,"none_admissible_outcome":"no_rule","policy_id":"task039e0_t1b_selection_v1","prior_proposal_visible":false,"same_initial_evidence_view":true,"same_model_config":true,"same_prompt_template":true,"schema_version":"1.0.0","selection_rule":"lowest_admissible_call_index","utility_based_selection":false,"verifier_feedback_visible":false}
